,tweet_count,City,id,tweet_text,timestamp,hashtags,username,mentions,rewtweets,replies,link,day,hour,minute
828,50.0,Butte County,1066492446551490560,"Saluting our military that are serving at the #campfire and around the world. #sacrafice #army #airforce #navy #marines #coastguard #camp2018 #thanksgiving @Oroville, California https://www.instagram.com/p/BqlWeJ5l9kq/?utm_source=ig_twitter_share&amp;igshid=2s6apa58tjye",2018-11-25 00:43:08+00:00,#campfire #sacrafice #army #airforce #navy #marines #coastguard #camp2018 #thanksgiving,AaronComfortDog,,1,0,https://twitter.com/AaronComfortDog/status/1066492446551490560,25,0,43
829,52.0,Butte County,1066473277785280514,Feather: Running,2018-11-24 23:26:58+00:00,,whats_running,,0,0,https://twitter.com/whats_running/status/1066473277785280514,24,23,26
830,65.0,Butte County,1066277060551806976,Feather: Running,2018-11-24 10:27:16+00:00,,whats_running,,0,0,https://twitter.com/whats_running/status/1066277060551806976,24,10,27
831,86.0,Butte County,1066093650206253056,Y’all gained that Thanksgiving “happy weight” yet? #ZiaAlexis @Lake Oroville https://www.instagram.com/p/BqihHmtngk-/?utm_source=ig_twitter_share&amp;igshid=1l8ge14kwnv0n,2018-11-23 22:18:27+00:00,#ZiaAlexis,ziaalexis,,0,1,https://twitter.com/ziaalexis/status/1066093650206253056,23,22,18
832,91.0,Butte County,1066079574998564864,Feather: Running,2018-11-23 21:22:32+00:00,,whats_running,,0,0,https://twitter.com/whats_running/status/1066079574998564864,23,21,22
833,94.0,Butte County,1066028899912597511,"A Pimp Named Slickback #ZiaAlexis @Oroville, California https://www.instagram.com/p/BqiDrGLnyf5/?utm_source=ig_twitter_share&amp;igshid=1ruot52v5gylg",2018-11-23 18:01:10+00:00,#ZiaAlexis,ziaalexis,,0,0,https://twitter.com/ziaalexis/status/1066028899912597511,23,18,1
834,98.0,Butte County,1065946671341744128,"Classic #ZiaAlexis @Oroville, California https://www.instagram.com/p/BqheRxxHf0X/?utm_source=ig_twitter_share&amp;igshid=1h2gu8hacoo69",2018-11-23 12:34:25+00:00,#ZiaAlexis,ziaalexis,,0,0,https://twitter.com/ziaalexis/status/1065946671341744128,23,12,34
835,105.0,Butte County,1065810302699220992,"I didn’t take many photos today, but it was a good day. So thankful that we all found a place to get together at the last minute despite everything going on. #blessed #thankful #family… https://www.instagram.com/p/BqggQtbA0pK/?utm_source=ig_twitter_share&amp;igshid=10aqqnwi7riyi",2018-11-23 03:32:32+00:00,#blessed #thankful #family,tmonterroza,,0,0,https://twitter.com/tmonterroza/status/1065810302699220992,23,3,32
836,117.0,Butte County,1065718729630261254,"As many of us settle in for a family meal, at @montecitofire we reflect on the last year and are Thankful for countless items, not the least of which is our ability to help others. Still… https://www.instagram.com/p/Bqf2oC4F7s-/?utm_source=ig_twitter_share&amp;igshid=eqaxn85webnt",2018-11-22 21:28:39+00:00,,montecitofire,@montecitofire,1,1,https://twitter.com/montecitofire/status/1065718729630261254,22,21,28
837,119.0,Butte County,1065703768015151105,Sneak peak of the bird! #happythanksgiving #traeger #jennieo #pioneerwomanrecipe erwinmike @Erwin Home https://www.instagram.com/p/Bqfv0h6HDW_2dyWowzcyEQ5xaowRrBJIzVFTbA0/?utm_source=ig_twitter_share&amp;igshid=plcqxzbocx0h,2018-11-22 20:29:12+00:00,#happythanksgiving #traeger #jennieo #pioneerwomanrecipe,CariErwin,,0,0,https://twitter.com/CariErwin/status/1065703768015151105,22,20,29
838,132.0,Butte County,1065645794521313280,Time to get phat... Happy Thanksgiving everybody . I’m not texting y’all individually because.... DAS TEW MUCH! Love y’all though #IllStillReplyThough… https://www.instagram.com/p/BqfVc_4nQ94/?utm_source=ig_twitter_share&amp;igshid=9mm41akuwo98,2018-11-22 16:38:50+00:00,#IllStillReplyThough,ziaalexis,,0,0,https://twitter.com/ziaalexis/status/1065645794521313280,22,16,38
839,148.0,Butte County,1065515209882812416,"“Learning is a gift. Even when pain is your teacher."" #aspiretoinspire #chronicpain #invisibleillness #medicalnegligence #aspiretoinspire #freckles #frecklesfordays #hatgirl… https://www.instagram.com/p/BqeaEV-Hkg0/?utm_source=ig_twitter_share&amp;igshid=xfnugmjlxbsg",2018-11-22 07:59:57+00:00,#aspiretoinspire #chronicpain #invisibleillness #medicalnegligence #aspiretoinspire #freckles #frecklesfordays #hatgirl,bridgit724,,0,0,https://twitter.com/bridgit724/status/1065515209882812416,22,7,59
840,149.0,Butte County,1065487832054157313,Enjoyed our time serving the evacuees of the #campfireparadise today. Even the rain didn’t keep people from coming. Thanks to all who helped organize this very large event to feed and care… https://www.instagram.com/p/BqeNn28gudT/?utm_source=ig_twitter_share&amp;igshid=23smguaom80m,2018-11-22 06:11:09+00:00,#campfireparadise,vlygrl4u,,0,0,https://twitter.com/vlygrl4u/status/1065487832054157313,22,6,11
841,157.0,Butte County,1065449868347338752,Huge THANK YOU to all who #donate #volunteer or #support us @houndsandheroes aside from the programs and help that’s provided on a daily bases @BJLaflin and her many teams continue to… https://www.instagram.com/p/Bqd37rnjU4-/?utm_source=ig_twitter_share&amp;igshid=153vcg887fgnw,2018-11-22 03:40:18+00:00,#donate #volunteer #support,masawesomer,@houndsandheroes @BJLaflin,0,0,https://twitter.com/masawesomer/status/1065449868347338752,22,3,40
842,173.0,Butte County,1065331502488174593,It’s raining in Paradise! Good news for fires but making it tough for displaced families from the fires. We will be cooking all day today with wckitchen laurenchandlercooks #campfire… https://www.instagram.com/p/BqdGiDiBfo8/?utm_source=ig_twitter_share&amp;igshid=1ikw6h63wd8pd,2018-11-21 19:49:57+00:00,#campfire,jenelleisaacson,,0,0,https://twitter.com/jenelleisaacson/status/1065331502488174593,21,19,49
843,202.0,Butte County,1065055342357303297,Not all heroes wear capes! So thankful for this father & son duo from Paradise RV who also lost their home to the Camp Fire for coming out to our tiny camper to… https://www.instagram.com/p/BqbI8gKF72uORwdDWlEU52U6pVKj2dLe4TuqdA0/?utm_source=ig_twitter_share&amp;igshid=3tt4eyq2zmgw,2018-11-21 01:32:36+00:00,,BristolPistolTN,,0,0,https://twitter.com/BristolPistolTN/status/1065055342357303297,21,1,32
844,205.0,Butte County,1065043165596524545,"Day One of Giving Thanks - cheesy grins and duck donations I'm so thankful for the people doing amazing things for those in need, especially for those recently displaced in Butte… https://www.instagram.com/p/BqbDZNBHn9s/?utm_source=ig_twitter_share&amp;igshid=8i8kb9d3hjgn",2018-11-21 00:44:12+00:00,,duckdaughterjj,,0,0,https://twitter.com/duckdaughterjj/status/1065043165596524545,21,0,44
845,206.0,Butte County,1065042757905932289,First normal #sunset in 10 days here due to the #californiawildfires in #buttecountystrong. The efforts by calfire and other #firstresponders is enormous. fema helping so many. Give… https://www.instagram.com/p/BqbDOgMFsyP/?utm_source=ig_twitter_share&amp;igshid=hec84ckvbkvv,2018-11-21 00:42:35+00:00,#sunset #californiawildfires #buttecountystrong #firstresponders,MarkFromKeyport,,0,0,https://twitter.com/MarkFromKeyport/status/1065042757905932289,21,0,42
846,241.0,Butte County,1064735784031461379,The only time these three are on their best behavior simultaneously is when I’m trying to eat dinner. #dinnerpawty @Oroville / Feather Falls Casino KOA Journey https://www.instagram.com/p/BqY3ojElPnjYA4XPveHqpz8IRVzt1chPbNy4jY0/?utm_source=ig_twitter_share&amp;igshid=144r73dq8r05u,2018-11-20 04:22:47+00:00,#dinnerpawty,BristolPistolTN,,0,0,https://twitter.com/BristolPistolTN/status/1064735784031461379,20,4,22
847,242.0,Butte County,1064729862181699584, #new #bloom #blooming #peace #naturegirl #naturelovers #succulentgarden #mysucculents #succulent #nature #cactus #succulentsofinstagram #myhappyplace #succulentjunkie #giftofnature… https://www.instagram.com/p/BqY08Jfnu_N/?utm_source=ig_twitter_share&amp;igshid=1g9anlxrpe9a9,2018-11-20 03:59:15+00:00,#new #bloom #blooming #peace #naturegirl #naturelovers #succulentgarden #mysucculents #succulent #nature #cactus #succulentsofinstagram #myhappyplace #succulentjunkie #giftofnature,bridgit724,,0,0,https://twitter.com/bridgit724/status/1064729862181699584,20,3,59
848,243.0,Butte County,1064729693876830209, #new #bloom #blooming #peace #naturegirl #naturelovers #succulentgarden #mysucculents #succulent #nature #cactus #succulentsofinstagram #myhappyplace #succulentjunkie #giftofnature… https://www.instagram.com/p/BqY03Rdn9AK/?utm_source=ig_twitter_share&amp;igshid=g6wb9vlnpw2b,2018-11-20 03:58:35+00:00,#new #bloom #blooming #peace #naturegirl #naturelovers #succulentgarden #mysucculents #succulent #nature #cactus #succulentsofinstagram #myhappyplace #succulentjunkie #giftofnature,bridgit724,,0,0,https://twitter.com/bridgit724/status/1064729693876830209,20,3,58
849,247.0,Butte County,1064706808374325249,Feather: Running,2018-11-20 02:27:39+00:00,,whats_running,,0,0,https://twitter.com/whats_running/status/1064706808374325249,20,2,27
850,255.0,Butte County,1064693821701844997,Been working on this non stop so happy it came together. Thankful to my team! I will be on the ground there to help support and coordinate all these efforts #Repost @houndsandheroes… https://www.instagram.com/p/BqYkck9FZ71/?utm_source=ig_twitter_share&amp;igshid=w3dh4ysxmvms,2018-11-20 01:36:02+00:00,#Repost,BJLaflin,@houndsandheroes,4,1,https://twitter.com/BJLaflin/status/1064693821701844997,20,1,36
851,266.0,Butte County,1064595323752861697,"As the sun rises over camp, the crews of SBC #RTF12 get briefed for their second day of clearing structures in Butte county. The RTF includes crews from @SantaMariaFire @SBCityFirePIO… https://www.instagram.com/p/BqX3v00lCE6/?utm_source=ig_twitter_share&amp;igshid=62b0sxy7qs4j",2018-11-19 19:04:39+00:00,#RTF12,montecitofire,@SantaMariaFire @SBCityFirePIO,2,0,https://twitter.com/montecitofire/status/1064595323752861697,19,19,4
852,269.0,Butte County,1064567712830107648,Reuben Comfort Dog and I were helping out at the distribution center for first responders whose families lost their homes. #buttecounty #firefighter #lawenforcement #firstresponders… https://www.instagram.com/p/BqXrMqOFCoL/?utm_source=ig_twitter_share&amp;igshid=qzhxh8v4zl8f,2018-11-19 17:14:56+00:00,#buttecounty #firefighter #lawenforcement #firstresponders,AaronComfortDog,,1,1,https://twitter.com/AaronComfortDog/status/1064567712830107648,19,17,14
853,285.0,Butte County,1064529875137118208,"Mission Accomplished! (See last post) Again, thanks to @r_sfoundation for remaining vigilant and thinking of us to help, the guys at @SpeedStrap for donating the mobility scooter, our… https://www.instagram.com/p/BqXZ_Q4lZ8w/?utm_source=ig_twitter_share&amp;igshid=1mz3mkb10qgfr",2018-11-19 14:44:34+00:00,,WarfighterMade,@r_sfoundation @SpeedStrap,0,0,https://twitter.com/WarfighterMade/status/1064529875137118208,19,14,44
854,287.0,Butte County,1064525535299158017,Feather: Running,2018-11-19 14:27:20+00:00,,whats_running,,0,0,https://twitter.com/whats_running/status/1064525535299158017,19,14,27
855,304.0,Butte County,1064389530843734017,Feather: Running http://whatsrunning.billdurr.com/sec/5589,2018-11-19 05:26:54+00:00,,whats_running,,0,0,https://twitter.com/whats_running/status/1064389530843734017,19,5,26
856,310.0,Butte County,1064329714356101120,Feather: Running,2018-11-19 01:29:12+00:00,,whats_running,,0,0,https://twitter.com/whats_running/status/1064329714356101120,19,1,29
857,317.0,Butte County,1064283955103506435,So many wonderful volunteers have come together to help the victims of the #campfire. #buttecounty #paradise #firefighter #calfire #lawenforcement #sheriff #chico #oroville #community… https://www.instagram.com/p/BqVqKTpFLA9/?utm_source=ig_twitter_share&amp;igshid=4tmpnpbec8uw,2018-11-18 22:27:22+00:00,#campfire #buttecounty #paradise #firefighter #calfire #lawenforcement #sheriff #chico #oroville #community,AaronComfortDog,,1,0,https://twitter.com/AaronComfortDog/status/1064283955103506435,18,22,27
858,321.0,Butte County,1064258170497851392,Reminder: OroNaz worship service at New Life Church (965 Grand Ave) at 4pm. #campfire @New Life Church Oroville https://www.instagram.com/p/BqVecHHHTvc/?utm_source=ig_twitter_share&amp;igshid=1h7v5law0akxz,2018-11-18 20:44:55+00:00,#campfire,OroNazChurch,,1,0,https://twitter.com/OroNazChurch/status/1064258170497851392,18,20,44
859,323.0,Butte County,1064248293809631239,"As if life isn’t already hard enough, poor Harvey went to go eat that fly and it turns out it was a bee and stung him on his lip. We got the stinger out and… https://www.instagram.com/p/BqVZkOBFlFrCcCLk-W99NUnuoCa1joMwgL8JB80/?utm_source=ig_twitter_share&amp;igshid=e51zvsm5iins",2018-11-18 20:05:40+00:00,,BristolPistolTN,,0,0,https://twitter.com/BristolPistolTN/status/1064248293809631239,18,20,5
860,334.0,Butte County,1064183407800971264,"“When I am afraid, I put my trust in you.” Psalm 56:3 #firstresponders #sheriff #buttecounty #campfire2018 #calfire @Oroville, California https://www.instagram.com/p/BqU8cFWlWDv/?utm_source=ig_twitter_share&amp;igshid=1m8p6s57rpo1m",2018-11-18 15:47:50+00:00,#firstresponders #sheriff #buttecounty #campfire2018 #calfire,AaronComfortDog,,0,0,https://twitter.com/AaronComfortDog/status/1064183407800971264,18,15,47
861,336.0,Butte County,1064116776143855617,Feather: Running,2018-11-18 11:23:04+00:00,,whats_running,,0,0,https://twitter.com/whats_running/status/1064116776143855617,18,11,23
862,337.0,Butte County,1064101398822809600,Feather: Running http://whatsrunning.billdurr.com/sec/5589,2018-11-18 10:21:58+00:00,,whats_running,,0,0,https://twitter.com/whats_running/status/1064101398822809600,18,10,21
863,338.0,Butte County,1064066254313525249,"Still as we stand badly burned and smoke covered. We as Butte county stand strong. #buttecountystrong @Oroville, California https://www.instagram.com/p/BqUEXwJHd_H/?utm_source=ig_twitter_share&amp;igshid=kembx5oj16el",2018-11-18 08:02:19+00:00,#buttecountystrong,jcquintana338,,0,0,https://twitter.com/jcquintana338/status/1064066254313525249,18,8,2
864,340.0,Butte County,1064053919599550465,Man Buys Time for Camp Fire Escapees by Using Garden Hose,2018-11-18 07:13:18+00:00,,FOX40,,1,0,https://twitter.com/FOX40/status/1064053919599550465,18,7,13
865,355.0,Butte County,1064014926493163520,We salute our military who are working tirelessly to support the firefighter’s in Paradise. #2018campfire #campfire2018 #campfire #army #airforce #firefighter #calfire #paradise #chico… https://www.instagram.com/p/BqTvyWHF7rK/?utm_source=ig_twitter_share&amp;igshid=1rh55t08pkvrq,2018-11-18 04:38:21+00:00,#2018campfire #campfire2018 #campfire #army #airforce #firefighter #calfire #paradise #chico,AaronComfortDog,,2,0,https://twitter.com/AaronComfortDog/status/1064014926493163520,18,4,38
866,356.0,Butte County,1064011290916675585,"El voraz incendio “Camp” en el norte de #California ha obligado a 40,000 personas a desalojar sus hogares. El incendio comenzó en la mañana del pasado jueves en el candado de #Butte, a… https://www.instagram.com/p/BqTuITDAzRZ/?utm_source=ig_twitter_share&amp;igshid=1x7x3y9y2583a",2018-11-18 04:23:54+00:00,#California #Butte,javillanueva67,,0,0,https://twitter.com/javillanueva67/status/1064011290916675585,18,4,23
867,361.0,Butte County,1063963196531376130,"Met these wonderful volunteers helping out those who have lost everything. #campfire #paradise #chico #calfire #wildlandfirefighter #firstresponders #hope #faith #love @Oroville, California https://www.instagram.com/p/BqTYS7Yl8X3/?utm_source=ig_twitter_share&amp;igshid=vu8yel701p8z",2018-11-18 01:12:48+00:00,#campfire #paradise #chico #calfire #wildlandfirefighter #firstresponders #hope #faith #love,AaronComfortDog,,0,1,https://twitter.com/AaronComfortDog/status/1063963196531376130,18,1,12
868,365.0,Butte County,1063937597829988353,"Helping out in Oroville today. Look at this smoke...reminds me of fog but it's much more dangerous. #oroville #california #freeway @Oroville, California https://www.instagram.com/p/BqTMfgRH-Hs/?utm_source=ig_twitter_share&amp;igshid=1m8cnsg65v20r",2018-11-17 23:31:04+00:00,#oroville #california #freeway,landopeezy,,0,0,https://twitter.com/landopeezy/status/1063937597829988353,17,23,31
869,368.0,Butte County,1063920344338182144,Feather: Running,2018-11-17 22:22:31+00:00,,whats_running,,0,0,https://twitter.com/whats_running/status/1063920344338182144,17,22,22
870,369.0,Butte County,1063893617390039043,“You gonna eat that?” #sisters #B&amp;G #Biscuits&amp;Georgia #drooling @Oroville / Feather Falls Casino KOA Journey https://www.instagram.com/p/BqS4qFrFHjnKQPHxbGPGzZ_vSw9LsdfP0dioo40/?utm_source=ig_twitter_share&amp;igshid=1w61k26la7xcr,2018-11-17 20:36:19+00:00,#sisters #B #Biscuits #drooling,BristolPistolTN,,0,0,https://twitter.com/BristolPistolTN/status/1063893617390039043,17,20,36
871,370.0,Butte County,1063891489388982273,Thank God for Crockpots. #southerncomfort @Oroville / Feather Falls Casino KOA Journey https://www.instagram.com/p/BqS3qZYl6l-Ba85Dclmc598334Bq-gDDeMMCco0/?utm_source=ig_twitter_share&amp;igshid=57vlv6nwy485,2018-11-17 20:27:51+00:00,#southerncomfort,BristolPistolTN,,0,0,https://twitter.com/BristolPistolTN/status/1063891489388982273,17,20,27
872,372.0,Butte County,1063852361792323584,"Our ca_ruralcounties RCRC family is coming together to support #ButteCounty. As we share our gratitude this Thanksgiving, let’s give with generosity to those who have lost everything in… https://www.instagram.com/p/BqSl3zvF9kh/?utm_source=ig_twitter_share&amp;igshid=yzz40d2wbffk",2018-11-17 17:52:23+00:00,#ButteCounty,StacyCorless,,0,0,https://twitter.com/StacyCorless/status/1063852361792323584,17,17,52
873,379.0,Butte County,1063814586896433154,"Signed in, ready for breakfast then today’s orders @Thermalito Forebay North Picnic Area https://www.instagram.com/p/BqST-Y0Bdec/?utm_source=ig_twitter_share&amp;igshid=74892pshculr",2018-11-17 15:22:16+00:00,,TahoeMarmot,,0,0,https://twitter.com/TahoeMarmot/status/1063814586896433154,17,15,22
874,380.0,Butte County,1063811732425097217,"Checking in at Command Post for today’s recovery efforts in Paradise, CA @Thermalito Forebay North Picnic Area https://www.instagram.com/p/BqSTagXhugF/?utm_source=ig_twitter_share&amp;igshid=1geq7sjr5uxh6",2018-11-17 15:10:56+00:00,,TahoeMarmot,,0,0,https://twitter.com/TahoeMarmot/status/1063811732425097217,17,15,10
875,384.0,Butte County,1063738994758963200,Feather: Running,2018-11-17 10:21:54+00:00,,whats_running,,0,0,https://twitter.com/whats_running/status/1063738994758963200,17,10,21
876,392.0,Butte County,1063640898527883265," #dlv . . #Repost buzzfeednews ・・・ The number of people reported unaccounted for in the California wildfires has skyrocketed to 1,011, and the death toll has risen to 74. The number of… https://www.instagram.com/p/BqRFumvhaXx/?utm_source=ig_twitter_share&amp;igshid=5u3rysh5fxpm",2018-11-17 03:52:06+00:00,#dlv #Repost,BETO_NAJERA,,0,0,https://twitter.com/BETO_NAJERA/status/1063640898527883265,17,3,52
877,406.0,Butte County,1063569466435543041,"Corned beef and Hash rap remix #rap #cooking #cookingthatcornedbeef #funny @Oroville, California https://www.instagram.com/p/BqQk9oFHjL-/?utm_source=ig_twitter_share&amp;igshid=1tly9xs5rhfbx",2018-11-16 23:08:15+00:00,#rap #cooking #cookingthatcornedbeef #funny,jcquintana338,,0,0,https://twitter.com/jcquintana338/status/1063569466435543041,16,23,8
878,409.0,Butte County,1063544162656706560,Feather: Running,2018-11-16 21:27:42+00:00,,whats_running,,0,0,https://twitter.com/whats_running/status/1063544162656706560,16,21,27
879,417.0,Butte County,1063476375481446400,"The air quality in Butte County is apparently the worst in the world right now. This is the view from my parents' back porch, which normally looks over the lake and the lake and, to the… https://www.instagram.com/p/BqP660pA1Jz/?utm_source=ig_twitter_share&amp;igshid=of988s1ze3u9",2018-11-16 16:58:21+00:00,,BurkholderAdam,,0,0,https://twitter.com/BurkholderAdam/status/1063476375481446400,16,16,58
880,430.0,Butte County,1063362955218247680,Feather: Running,2018-11-16 09:27:39+00:00,,whats_running,,0,0,https://twitter.com/whats_running/status/1063362955218247680,16,9,27
881,435.0,Butte County,1063309917052956672," Laugh often. Love hard. Live with no regrets Through all health struggles, I try #nottakentoday #selflove #aspire2inspire #ileostomyawareness #ostomylife #curls #ostomyawareness… https://www.instagram.com/p/BqOvOcGHNOw/?utm_source=ig_twitter_share&amp;igshid=1kc615zpl8r5p",2018-11-16 05:56:54+00:00,#nottakentoday #selflove #aspire2inspire #ileostomyawareness #ostomylife #curls #ostomyawareness,bridgit724,,0,0,https://twitter.com/bridgit724/status/1063309917052956672,16,5,56
882,438.0,Butte County,1063282746926215168,"DIY air filter mask #soldoutcomeback #usewhatyougot #buttecountyfire #wooselyfire #californiafires #staysafe #essentialoils @Butte County, California https://www.instagram.com/p/BqOiq3sHmZJ/?utm_source=ig_twitter_share&amp;igshid=1hphjyiia1spp",2018-11-16 04:08:56+00:00,#soldoutcomeback #usewhatyougot #buttecountyfire #wooselyfire #californiafires #staysafe #essentialoils,coragerikwan,,0,0,https://twitter.com/coragerikwan/status/1063282746926215168,16,4,8
883,457.0,Butte County,1063166651993075720,Feather: Running,2018-11-15 20:27:37+00:00,,whats_running,,0,0,https://twitter.com/whats_running/status/1063166651993075720,15,20,27
884,464.0,Butte County,1063139206522961921,"If anyone can donate Blankets, Comforters, Quilts, Sheets, dog and cat food. As of last night there were over 800 dogs and cats at the Chico airport. Some… https://www.instagram.com/p/BqNhlysnLH5SeaxUzikWjGzIT4vkNzBgD_Zseo0/?utm_source=ig_twitter_share&amp;igshid=1m4iuoy9nck7",2018-11-15 18:38:33+00:00,,KariAngelEyes,,0,1,https://twitter.com/KariAngelEyes/status/1063139206522961921,15,18,38
885,478.0,Butte County,1062970322507456512,Feather: Running,2018-11-15 07:27:28+00:00,,whats_running,,0,0,https://twitter.com/whats_running/status/1062970322507456512,15,7,27
886,491.0,Butte County,1062865302319480837,My mom got me an actual mask but I couldn’t get it before I had to go out so this will do in the meantime. It’s crazy going out like this I feel like an… https://www.instagram.com/p/BqLlCLKHxW3YplsNBPVobAbDLvcGttCkDGtROs0/?utm_source=ig_twitter_share&amp;igshid=1hc7u8iwag4fm,2018-11-15 00:30:09+00:00,,AicheleBree,,0,0,https://twitter.com/AicheleBree/status/1062865302319480837,15,0,30
887,502.0,Butte County,1062815063499776003,"#CampFire daily chapel services at OroNaz. For a half an hour each afternoon we are gathering for worship, encouragement, reading of scripture and prayer. @Oroville Church of the Nazarene https://www.instagram.com/p/BqLOLzwnpqv/?utm_source=ig_twitter_share&amp;igshid=1s4i8fpz9v815",2018-11-14 21:10:31+00:00,#CampFire,OroNazChurch,,2,0,https://twitter.com/OroNazChurch/status/1062815063499776003,14,21,10
888,509.0,Butte County,1062774152703197194,Feather: Running,2018-11-14 18:27:58+00:00,,whats_running,,0,0,https://twitter.com/whats_running/status/1062774152703197194,14,18,27
889,512.0,Butte County,1062754664775647233,"We got the uncontrollable giggles when this guy won big on a machine the other night. I think it's cause we always joke & say 'lets win dinner before we leave' & usually he does, with a… https://www.instagram.com/p/BqKyt1IHxqt/?utm_source=ig_twitter_share&amp;igshid=gxzcx6u5b5k5",2018-11-14 17:10:31+00:00,,SummaCeleste,,0,0,https://twitter.com/SummaCeleste/status/1062754664775647233,14,17,10
890,521.0,Butte County,1062591464029519873,Feather: Running,2018-11-14 06:22:01+00:00,,whats_running,,0,0,https://twitter.com/whats_running/status/1062591464029519873,14,6,22
891,583.0,Butte County,1062077326026895360,"So for those who haven’t heard, #campfire , hit my home away from home up north. Butte County was hit with the most destructive wildfire in California and left… https://www.instagram.com/p/BqF-sX0FrXSEaKFK8A4lTnatIISUs-bjXDOc7k0/?utm_source=ig_twitter_share&amp;igshid=4uydmfvadwv6",2018-11-12 20:19:01+00:00,#campfire,wolfandrew_,,2,0,https://twitter.com/wolfandrew_/status/1062077326026895360,12,20,19
892,610.0,Butte County,1061946365314560000,Cutting line and backfiring! @Lake Oroville State Recreation Area https://www.instagram.com/p/BqFCrDlAE2eYCuA_51w3m53s7wavWCSN0CB4EM0/?utm_source=ig_twitter_share&amp;igshid=1i45g3v4nv9rm,2018-11-12 11:38:38+00:00,,Dozerman42,,0,0,https://twitter.com/Dozerman42/status/1061946365314560000,12,11,38
893,611.0,Butte County,1061945777805647873,Hey it’s break time!! @Lake Oroville State Recreation Area https://www.instagram.com/p/BqFCyEvgRsbbEZIfZeD6Lm6BMju64Gd8P8Fyn40/?utm_source=ig_twitter_share&amp;igshid=y7lqdh3ovavd,2018-11-12 11:36:18+00:00,,Dozerman42,,0,0,https://twitter.com/Dozerman42/status/1061945777805647873,12,11,36
894,642.0,Butte County,1061742614888759297,"I get to work with my buddy #lcck9reuben today. #firstresponders #campfire #firefighter #police @Oroville, California https://www.instagram.com/p/BqDmWbzlFAz/?utm_source=ig_twitter_share&amp;igshid=16ga079qk1vaq",2018-11-11 22:09:00+00:00,#lcck9reuben #firstresponders #campfire #firefighter #police,AaronComfortDog,,0,0,https://twitter.com/AaronComfortDog/status/1061742614888759297,11,22,9
895,643.0,Butte County,1061713058320408576,MacrobiAmerica does it one more time. Thank you for inspiring my soul but most of all your love and caring. LOVE http://wannatalkhealth.com#veganrecipes #downtowncourtenay… https://www.instagram.com/p/BqDY0I4HQXi/?utm_source=ig_twitter_share&amp;igshid=id33yte5ouhc,2018-11-11 20:11:33+00:00,#downtowncourtenay,wannatalkhealth,,0,0,https://twitter.com/wannatalkhealth/status/1061713058320408576,11,20,11
896,671.0,Butte County,1061475322707804160,Feather: Running,2018-11-11 04:26:52+00:00,,whats_running,,0,0,https://twitter.com/whats_running/status/1061475322707804160,11,4,26
